title,year,journal,authors,doi,url,source,collected_at
Regenerating the periodontium: is there a magic formula?,2005,Orthodontics &amp; Craniofacial Research,"BL Foster, MJ Somerman",10.1111/j.1601-6343.2005.00351.x,https://doi.org/10.1111/j.1601-6343.2005.00351.x,crossref,2025-10-09T13:42:52+00:00
The Effect of Base Coat Thickness on the Water Resistance of Class PB (Polymer Based) Exterior Insulation and Finish Systems (EIFS),1996,"Exterior Insulation Finish Systems (EIFS): Materials, Properties, and Performance","MF Williams, BL Williams",10.1520/stp39215s,https://doi.org/10.1520/stp39215s,crossref,2025-10-09T13:42:52+00:00
Water Intrusion in Barrier and Cavity/Rain Screen Walls,1991,Water in Exterior Building Walls: Problems and Solutions,"MF Williams, BL Williams",10.1520/stp17691s,https://doi.org/10.1520/stp17691s,crossref,2025-10-09T13:42:52+00:00
Reaction of norbornadiene with methyl diazoacetate,1972,Australian Journal of Chemistry,"J Lam, BL Johnson",10.1071/ch9722269,https://doi.org/10.1071/ch9722269,crossref,2025-10-09T13:42:52+00:00
Growth and behavioral responses to elevated temperatures by juvenile sablefish Anoplopoma fimbria and the interactive role of food availability,2001,Marine Ecology Progress Series,"SM Sogard, BL Olla",10.3354/meps217121,https://doi.org/10.3354/meps217121,crossref,2025-10-09T13:42:52+00:00
Role of ecological interactions in saltmarsh geomorphic processes,2021,Marine Ecology Progress Series,"BL Williams, DS Johnson",10.3354/meps13554,https://doi.org/10.3354/meps13554,crossref,2025-10-09T13:42:52+00:00
The Legal Protection of Public and Private Plant Varieties in India: A Comparative Analysis,2013,Journal of Bioremediation &amp; Biodegradation,BL Manjunatha DUM Rao,10.4172/2155-6199.1000207,https://doi.org/10.4172/2155-6199.1000207,crossref,2025-10-09T13:42:52+00:00
KIF14 (kinesin family member 14),2011,Atlas of Genetics and Cytogenetics in Oncology and Haematology,"BL Thériault, TW Corson",10.4267/2042/38552,https://doi.org/10.4267/2042/38552,crossref,2025-10-09T13:42:52+00:00
Investigating the roles and functions of Rab23 in primary ciliogenesis,2012,Cilia,"YS Lim, BL Tang",10.1186/2046-2530-1-s1-p33,https://doi.org/10.1186/2046-2530-1-s1-p33,crossref,2025-10-09T13:42:52+00:00
Book reviews,1963,Vegetatio,"Br.-Bl., H. Niklfeld",10.1007/bf00298838,https://doi.org/10.1007/bf00298838,crossref,2025-10-09T13:42:52+00:00
Low temperature annealing of He+ implanted optical waveguides in LiNbO3,1988,Vacuum,"CN Ahmad, BL Weiss",10.1016/0042-207x(88)90609-4,https://doi.org/10.1016/0042-207x(88)90609-4,crossref,2025-10-09T13:42:52+00:00
Oxygen Compatibility of FKM Elastomers,1997,Flammability and Sensitivity of Materials in Oxygen-Enriched Atmospheres: Eighth Volume,"VJ D'Imperio, BL Werley",10.1520/stp12063s,https://doi.org/10.1520/stp12063s,crossref,2025-10-09T13:42:52+00:00
An analysis of snow cover patterns in a small alpine catchment,1992,Hydrological Processes,"G.öschl Bl, R. Kirnbauer",10.1002/hyp.3360060109,https://doi.org/10.1002/hyp.3360060109,crossref,2025-10-09T13:42:52+00:00
Neovascularisation of the meniscus with angiogenin. An experimental study in rabbits,1991,The Journal of Bone and Joint Surgery. British volume,"TV King, BL Vallee",10.1302/0301-620x.73b4.1712788,https://doi.org/10.1302/0301-620x.73b4.1712788,crossref,2025-10-09T13:42:52+00:00
Cryosurgery of plantar warts,1979,Journal of the American Podiatric Medical Association,"BL Limmer, LT Bogy",10.7547/87507315-69-12-713,https://doi.org/10.7547/87507315-69-12-713,crossref,2025-10-09T13:42:52+00:00
The abridged South African hypertension guideline 2011,2013,South African Family Practice,"YK Seedat, BL Rayner",10.1080/20786204.2013.10874319,https://doi.org/10.1080/20786204.2013.10874319,crossref,2025-10-09T13:42:52+00:00
Les Espagnols de l'Auvergne et du Limousin du XVIIe au XIXe siècle,1986,Population (French Edition),"A. Bl., A. Poitrineau",10.2307/1533070,https://doi.org/10.2307/1533070,crossref,2025-10-09T13:42:52+00:00
Quaternary Ammonium Compounds Were More Effective Than a Phenolic Compound or Sodium Hypochlorite in Inhibiting Growth of Phytophthora Cinnamomi (Rands).,1985,Australasian Plant Pathology,"GL Noske, BL Shearer",10.1071/app9850037,https://doi.org/10.1071/app9850037,crossref,2025-10-09T13:42:52+00:00
An epigenetic mechanism for carcinogenesis,1971,Zeitschrift f�r Krebsforschung und Klinische Onkologie,"R. Tsanev, Bl. Sendov",10.1007/bf00304033,https://doi.org/10.1007/bf00304033,crossref,2025-10-09T13:42:52+00:00
Development and Properties of <u>Transport</u> -- a New Inert Granular Carrier,1990,Pesticide Formulations and Application Systems: 10th Volume,"BW Moechnig, BL Wilhelm",10.1520/stp25369s,https://doi.org/10.1520/stp25369s,crossref,2025-10-09T13:42:52+00:00
Review: Neural correlates of consciousness,2009,African Journal of Psychiatry,"BL Negrao, M Viljoen",10.4314/ajpsy.v12i4.49040,https://doi.org/10.4314/ajpsy.v12i4.49040,crossref,2025-10-09T13:42:52+00:00
Comment on Ramage et al.: Consensus Guidelines for the Management of Patients with Digestive Neuroendocrine Tumours: Well-Differentiated Colon and Rectum Tumour/Carcinoma,2008,Neuroendocrinology,Hans Scher&uuml;bl,10.1159/000158560,https://doi.org/10.1159/000158560,crossref,2025-10-09T13:42:52+00:00
Nutrient balance of a shallow coastal embayment: I. Patterns of groundwater discharge,1994,Marine Ecology Progress Series,"NP Millham, BL Howes",10.3354/meps112155,https://doi.org/10.3354/meps112155,crossref,2025-10-09T13:42:52+00:00
Vaginal birth after cesarean section: Is suspected fetal macrosomia a contraindication?,1990,International Journal of Gynecology &amp; Obstetrics,"BL Flamm, JR Goings",10.1016/0020-7292(90)90512-j,https://doi.org/10.1016/0020-7292(90)90512-j,crossref,2025-10-09T13:42:52+00:00
PANCREATIC PSEUDOANEURYSM  A CASE REPORT,2022,International Journal of  Medical Reviews and Case Reports,"Chandan R, Dharmendra BL",10.5455/ijmrcr.172-1643736240,https://doi.org/10.5455/ijmrcr.172-1643736240,crossref,2025-10-09T13:42:52+00:00
Treatment Options for Hepatitis B,2007,Canadian Journal of Infectious Diseases and Medical Microbiology,"JM Conly, BL Johnston",10.1155/2007/464652,https://doi.org/10.1155/2007/464652,crossref,2025-10-09T13:42:52+00:00
Why the West in West Nile Virus Infections?,2007,Canadian Journal of Infectious Diseases and Medical Microbiology,"JM Conly, BL Johnston",10.1155/2007/704157,https://doi.org/10.1155/2007/704157,crossref,2025-10-09T13:42:52+00:00
Role of epidermal growth factor receptor transactivation in the amplification of Helicobacter pylori-elicited induction in gastric mucosal expression of cyclooxygenase-2 and inducible nitric oxide synthase,2013,OA Inflammation,"BL Slomiany, A Slomiany",10.13172/2052-787x-1-1-412,https://doi.org/10.13172/2052-787x-1-1-412,crossref,2025-10-09T13:42:52+00:00
Role of lipid peroxidation in the inhibition of mononuclear cell proliferation by normal lipoproteins,1991,Journal of Lipid Research,"BL Kasiske, WF Keane",10.1016/s0022-2275(20)42029-2,https://doi.org/10.1016/s0022-2275(20)42029-2,crossref,2025-10-09T13:42:52+00:00
Noradrenergic modulation of the masseteric reflex in behaving cats. I. Pharmacological studies,1990,The Journal of Neuroscience,"IL Stafford, BL Jacobs",10.1523/jneurosci.10-01-00091.1990,https://doi.org/10.1523/jneurosci.10-01-00091.1990,crossref,2025-10-09T13:42:52+00:00
Accuracy and correlates of maternal recall of birthweight and gestational age,2008,BJOG: An International Journal of Obstetrics &amp; Gynaecology,"ARA Adegboye, BL Heitmann",10.1111/j.1471-0528.2008.01717.x,https://doi.org/10.1111/j.1471-0528.2008.01717.x,crossref,2025-10-09T13:42:52+00:00
Hausdorgsche metrik und approximationen,1966,Numerische Mathematik,"B. Penkov, Bl. Sendov",10.1007/bf02162085,https://doi.org/10.1007/bf02162085,crossref,2025-10-09T13:42:52+00:00
Beiträge zur Generalisation der Genitaltuberkulose in der Schwangerschaft,1960,Beiträge zur Klinik der Tuberkulose und spezifischen Tuberkulose-Forschung,"Bl. Szendi, V. Heim",10.1007/bf02146101,https://doi.org/10.1007/bf02146101,crossref,2025-10-09T13:42:52+00:00
"Substituted endo-Tricyclo[3,2,1,02,4]oct-6-enes. I. Preparation by the Diels-Alder reaction between cyclopropene and substituted cyclopentadienes",1975,Australian Journal of Chemistry,"RI Kagi, BL Johnson",10.1071/ch9752175,https://doi.org/10.1071/ch9752175,crossref,2025-10-09T13:42:52+00:00
Memahami Penerapan Taurat Pada Masa Yesus dan Implikasinya Dalam Menghayati Firman Tuhan Pada Masa Kini,2020,Jurnal Teologi Berita Hidup,Sri Lina BL Simorangkir,10.38189/jtbh.v3i1.55,https://doi.org/10.38189/jtbh.v3i1.55,crossref,2025-10-09T13:42:52+00:00
<i>Clostridium difficile:</i> The Evolving Story,2007,Canadian Journal of Infectious Diseases and Medical Microbiology,"BL Johnston, JM Conly",10.1155/2007/615827,https://doi.org/10.1155/2007/615827,crossref,2025-10-09T13:42:52+00:00
Cumulative Fatigue Damage of Angle-Plied Fiber-Reinforced Elastomer Composites and Its Dependence on Minimum Stress,1996,Advances in Fatigue Lifetime Predictive Techniques: 3rd Volume,"DS Liu, BL Lee",10.1520/stp16132s,https://doi.org/10.1520/stp16132s,crossref,2025-10-09T13:42:52+00:00
Rehabilitation of Delinquents: The Tale of an Experience,1977,Journal of Forensic Sciences,"DM Turns, BL Silber",10.1520/jfs10391j,https://doi.org/10.1520/jfs10391j,crossref,2025-10-09T13:42:52+00:00
Dual Regulation of Proton‐ and Sodium‐Coupled Phosphate Transport Systems in the Yarrowia lipolytica Yeast by Extracellular Phosphate and pH,2003,IUBMB Life,"R. Zvyagilskaya, BL Persson",10.1080/1521654031000106681,https://doi.org/10.1080/1521654031000106681,crossref,2025-10-09T13:42:52+00:00
"Progress in the purification and characterization of an engorgement factor from the gonad of the male ixodid tick, Amblyomma hebraeum",1999,Comparative Biochemistry and Physiology Part A: Molecular &amp; Integrative Physiology,"BL Weiss, WR Kaufman",10.1016/s1095-6433(99)90301-x,https://doi.org/10.1016/s1095-6433(99)90301-x,crossref,2025-10-09T13:42:52+00:00
Review of 1261 one-step resectoscopic myomectomies,2001,The Journal of the American Association of Gynecologic Laparoscopists,"BL Lin, K Seki",10.1016/s1074-3804(01)80120-1,https://doi.org/10.1016/s1074-3804(01)80120-1,crossref,2025-10-09T13:42:52+00:00
Transfusion Practice in Dengue,2015,Transfusion Update,"BL Bhardwaj, Harnoor Bhardwaj",10.5005/jp/books/12449_30,https://doi.org/10.5005/jp/books/12449_30,crossref,2025-10-09T13:42:52+00:00
Use of Electronic Information Resources by postgraduate students: a case study,2013,Journal of the University Librarians Association of Sri Lanka,"ND Peiris, BL Peiris",10.4038/jula.v16i1.5197,https://doi.org/10.4038/jula.v16i1.5197,crossref,2025-10-09T13:42:52+00:00
"How many, and when? Optimising targeted gene flow for a step change in the environment",2018,,"E. Kelly, BL. Phillips",10.1101/341339,https://doi.org/10.1101/341339,crossref,2025-10-09T13:42:52+00:00
Comparison of Slug Test Methodologies for Determination of Hydraulic Conductivity in Fine-Grained Sediments,1990,Ground Water and Vadose Zone Monitoring,"BL Herzog, WJ Morse",10.1520/stp23405s,https://doi.org/10.1520/stp23405s,crossref,2025-10-09T13:42:52+00:00
"B. Southall, D. P. Novacek",2009,Marine Ecology Progress Series,"BL Southall, DP Novacek",10.3354/meps08393,https://doi.org/10.3354/meps08393,crossref,2025-10-09T13:42:52+00:00
Rab23 has a novel role in the trafficking of Kif17 to the primary cilia,2015,Cilia,"YS Lim, BL Tang",10.1186/2046-2530-4-s1-p18,https://doi.org/10.1186/2046-2530-4-s1-p18,crossref,2025-10-09T13:42:52+00:00
Estimated NH3-volatilization losses from surface-applied urea on a wet calcareous Vertisol,1983,Fertilizer Research,"JF Trierweiler, BL Bishop",10.1007/bf01049483,https://doi.org/10.1007/bf01049483,crossref,2025-10-09T13:42:52+00:00
"Control of Benomyl resistant strains of green mould of citrus with Sodium Ortho-Phenylphenate, 2-Aminobutane and Imazalil.",1976,Australasian Plant Pathology,"LE Rippon, BL Wild",10.1071/app9760045,https://doi.org/10.1071/app9760045,crossref,2025-10-09T13:42:52+00:00
Matrix Cracking in Short Fiber Reinforced Composites under Static and Fatigue Loading,1982,Composite Materials: Testing and Design (6th Conference),"JF Mandell, BL Lee",10.1520/stp28482s,https://doi.org/10.1520/stp28482s,crossref,2025-10-09T13:42:52+00:00
Thyroiditis: can we depend on the clinical features to diagnose?,2009,Galle Medical Journal,"MB Samarawickrama, BL Perera",10.4038/gmj.v14i1.1171,https://doi.org/10.4038/gmj.v14i1.1171,crossref,2025-10-09T13:42:52+00:00
Central cardiovascular dynamics of ducks,1975,American Journal of Physiology-Legacy Content,"BL Langille, DR Jones",10.1152/ajplegacy.1975.228.6.1856,https://doi.org/10.1152/ajplegacy.1975.228.6.1856,crossref,2025-10-09T13:42:52+00:00
"Susceptibility of Plant Species in Banksia Woodlands on the Swan Coastal Plain, Western Australia, to Infection by Phytophthora cinnamomi",1996,Australian Journal of Botany,"BL Shearer, M Dillon",10.1071/bt9960433,https://doi.org/10.1071/bt9960433,crossref,2025-10-09T13:42:52+00:00
Erfahrungen mit der Lysotypie bei der Typhusdiagnose,1955,Zeitschrift für Hygiene und Infektionskrankheiten,"Bl. Freytag, E. Plochmann",10.1007/bf02150088,https://doi.org/10.1007/bf02150088,crossref,2025-10-09T13:42:52+00:00
Computer simulation of the regenerative processes in the liver,1968,Journal of Theoretical Biology,"Bl. Sendov, R. Tsanev",10.1016/0022-5193(68)90172-0,https://doi.org/10.1016/0022-5193(68)90172-0,crossref,2025-10-09T13:42:52+00:00
General diagnosis case of the day. Multilocular cystic nephroma (MLCN),1989,American Journal of Roentgenology,"BL McClennan, GL Andriole",10.2214/ajr.152.6.1321,https://doi.org/10.2214/ajr.152.6.1321,crossref,2025-10-09T13:42:52+00:00
Obstructed hepatic flexure contained in a right-sided inguinoscrotal hernia resulting in caecal perforation,2013,The Annals of The Royal College of Surgeons of England,"BL Skelly, AK Neill",10.1308/003588413x13629960047551,https://doi.org/10.1308/003588413x13629960047551,crossref,2025-10-09T13:42:52+00:00
The Adolescent With Asthma: Fostering Adherence to Optimize Therapy,2008,Clinical Pharmacology &amp; Therapeutics,"BL Jones, KJ Kelly",10.1038/clpt.2008.189,https://doi.org/10.1038/clpt.2008.189,crossref,2025-10-09T13:42:52+00:00
The confounding influence of sun exposure in melanoma,1998,The Lancet,"BL Diffey, HP Gies",10.1016/s0140-6736(05)79381-8,https://doi.org/10.1016/s0140-6736(05)79381-8,crossref,2025-10-09T13:42:52+00:00
"Contribution of denitrification to nitrogen, carbon, and oxygen cycling in tidal creek sediments of a New England salt marsh",2003,Marine Ecology Progress Series,"MR Hamersley, BL Howes",10.3354/meps262055,https://doi.org/10.3354/meps262055,crossref,2025-10-09T13:42:52+00:00
Ode to Oseltamivir and Amantadine?,2006,Canadian Journal of Infectious Diseases and Medical Microbiology,"JM Conly, BL Johnston",10.1155/2006/106989,https://doi.org/10.1155/2006/106989,crossref,2025-10-09T13:42:52+00:00
SEROLOGICAL RESPONSES OF SHEEP AND CATTLE EXPOSED TO NATURAL <i>TOXOPLASMA</i> INFECTION,1979,Australian Journal of Experimental Biology and Medical Science,"BL Munday, A Corbould",10.1038/icb.1979.14,https://doi.org/10.1038/icb.1979.14,crossref,2025-10-09T13:42:52+00:00
Movies for human CST-Pola-primase bound to 6xTEL DNA template,2023,EMPIAR dataset,"He Q, Lin X, Chavez BL, Agrawal S, Lusk BL, Lim C",10.6019/empiar-11359,https://doi.org/10.6019/empiar-11359,crossref,2025-10-09T13:42:52+00:00
�ber Gef��wandver�nderungen nach Einwirken von Alkylcyanoacrylat-Klebern,1967,Langenbecks Archiv f�r Klinische Chirurgie,"R. Gottlob, G. Bl�mel",10.1007/bf01440768,https://doi.org/10.1007/bf01440768,crossref,2025-10-09T13:42:52+00:00
"Spectroscopic and Computational approach for the Structure - Property relationship of Hydantoin drug impurity : 1-methyl-5,5-diphenylimidazolidine-2, 4-dione",2019,IOP Conference Series: Materials Science and Engineering,"S Anil Kumar, BL Bhaskar",10.1088/1757-899x/577/1/012180,https://doi.org/10.1088/1757-899x/577/1/012180,crossref,2025-10-09T13:42:52+00:00
Movies for human CST-Pola-primase bound to 3xTEL DNA template,2023,EMPIAR dataset,"He Q, Lin X, Chavez BL, Agrawal S, Lusk BL, Lim C",10.6019/empiar-11358,https://doi.org/10.6019/empiar-11358,crossref,2025-10-09T13:42:52+00:00
Performance Study of 72V PMBLDC Motor in Light Electric Vehicles,2024,"2024 IEEE International Conference on Distributed Computing, VLSI, Electrical Circuits and Robotics (DISCOVER)","Dhananjaya B, Rajalakshmi Samaga BL",10.1109/discover62353.2024.10750648,https://doi.org/10.1109/discover62353.2024.10750648,crossref,2025-10-09T13:42:52+00:00
Lack of detectable DNA uptake by transformation of selected recipients in mono-associated rats,2010,BMC Research Notes,"Andrea Wilcks, Bodil BL Jacobsen",10.1186/1756-0500-3-49,https://doi.org/10.1186/1756-0500-3-49,crossref,2025-10-09T13:42:52+00:00
Das Pneumotachogramm bei S�uglingen in den ersten Lebenstagen,1962,Pfl�gers Archiv f�r die Gesamte Physiologie des Menschen und der Tiere,"Norbert Hahn, Alois Bl�mer",10.1007/bf00362188,https://doi.org/10.1007/bf00362188,crossref,2025-10-09T13:42:52+00:00
"Untersuchung einiger Dreistoffsysteme vom Typ MeCl<sub>2</sub>HClH<sub>2</sub>O (Me = Ni<sup>2+</sup>, Mn<sup>2+</sup>, Fe<sup>2+</sup>)",1979,Zeitschrift für anorganische und allgemeine Chemie,"Chr. Balarew, Spassow, Bl. Simeonowa",10.1002/zaac.19794510125,https://doi.org/10.1002/zaac.19794510125,crossref,2025-10-09T13:42:52+00:00
Automated trace-matrix-separation techniques coupled with simultaneous ICP-AES for trace analysis in refractory metals ? A comparison with other techniques,1992,Fresenius' Journal of Analytical Chemistry,"Wilhelm Bl�dorn, Joachim Luck",10.1007/bf00633546,https://doi.org/10.1007/bf00633546,crossref,2025-10-09T13:42:52+00:00
A Patient with ARDS and Cardiogenic Shock Caused by Streptococcus Pyogenes Successfully Treated by V-A-V ECMO,2019,Journal of Surgery: Open Access,"Quang TN, Dang TN, Van BL, Ngoc QN, Thai BL, Tran GT",10.16966/2470-0991.184,https://doi.org/10.16966/2470-0991.184,crossref,2025-10-09T13:42:53+00:00
A multigrid method for a parameter dependent problem in solid mechanics,1990,Numerische Mathematik,"D. Braess, C. Bl�mer",10.1007/bf01386441,https://doi.org/10.1007/bf01386441,crossref,2025-10-09T13:42:53+00:00
Korrosion und Metallose bei der B�ndelnagelung,1965,Langenbecks Archiv f�r Klinische Chirurgie,"H. Schnabelmaier, J. Bl�ml",10.1007/bf01440782,https://doi.org/10.1007/bf01440782,crossref,2025-10-09T13:42:53+00:00
Anionic polymerization of lactones initiated by alkali graphitides. III. Polymerization of δ‐valerolactone initiated by KC<sub>24</sub>,1984,Journal of Polymer Science: Polymer Chemistry Edition,"Iliya Bl. Rashkov, Ivan Gitsov",10.1002/pol.1984.170220402,https://doi.org/10.1002/pol.1984.170220402,crossref,2025-10-09T13:42:53+00:00
NMR imaging of polymer materials,1993,Die Makromolekulare Chemie,"Bernhard Bl¨︁umich, Peter Blümler",10.1002/macp.1993.021940801,https://doi.org/10.1002/macp.1993.021940801,crossref,2025-10-09T13:42:53+00:00
Entwicklung der Beckenform und Lageentwicklung des weiblichen Genitalapparates um die Mitte der Fetalzeit,1959,Archiv f�r Gyn�kologie,"Erich Bl�mer, Ludwig Keller",10.1007/bf00669833,https://doi.org/10.1007/bf00669833,crossref,2025-10-09T13:42:53+00:00
Das Verhalten des leicht abspaltbaren Bluteisens bei der Kohlenoxydvergiftung,1947,Naunyn-Schmiedeberg's Archiv f�r Experimentelle Pathologie und Pharmakologie,"Klaus Bl�mer, Manfred Kiese",10.1007/bf00738357,https://doi.org/10.1007/bf00738357,crossref,2025-10-09T13:42:53+00:00
Embryogenesis of the connective chordotonal organ in the pedicel of the American cockroach: Cell lineage and morphological differentiation,1988,Cell and Tissue Research,"Rudolf Bl�chl, Roland Selzer",10.1007/bf00216655,https://doi.org/10.1007/bf00216655,crossref,2025-10-09T13:42:53+00:00
Follow-up results 20 years after surgical treatment of habitual ventral shoulder luxation using the Eden-Lange technique,1997,Archives of Orthopaedic and Trauma Surgery,"E. Neusel, K. Bl�sius",10.1007/bf00393713,https://doi.org/10.1007/bf00393713,crossref,2025-10-09T13:42:53+00:00
19. Elimination of the canine Roux stasis syndrome by the uncut Roux operation,1994,The American Journal of Surgery,"BL Nguyen Tu, KA Kelly",10.1016/0002-9610(94)90151-1,https://doi.org/10.1016/0002-9610(94)90151-1,crossref,2025-10-09T13:42:53+00:00
The Rise of Brazil as a Global Development Power,2012,Third World Quarterly,"Peter Dauvergne, Déborah BL Farias",10.1080/01436597.2012.674704,https://doi.org/10.1080/01436597.2012.674704,crossref,2025-10-09T13:42:53+00:00
Zur Morphologie und Funktion der Calcitoninzellen (C-Zellen) der Ratte,1972,Zeitschrift f�r Zellforschung und Mikroskopische Anatomie,"S. Bl�hser, B. Schnorr",10.1007/bf00307233,https://doi.org/10.1007/bf00307233,crossref,2025-10-09T13:42:53+00:00
Structural Styles of the Paradox Basin: Something to Consider in a Basin Dominated by Stratigraphic Traps,1993,AAPG Bulletin,"STEVENSON, GENE M., Independent, Bl",10.1306/bdff76d8-1718-11d7-8645000102c1865d,https://doi.org/10.1306/bdff76d8-1718-11d7-8645000102c1865d,crossref,2025-10-09T13:42:53+00:00
Cloning and characterization of the gene coding for the aerobic azoreductase from Pigmentiphaga kullae K24,2003,Applied Microbiology and Biotechnology,"S. Bl�mel, A. Stolz",10.1007/s00253-003-1316-5,https://doi.org/10.1007/s00253-003-1316-5,crossref,2025-10-09T13:42:53+00:00
Hausdorff Metric and its Applications,1972,International Series of Numerical Mathematics / Internationale Schriftenreihe zur Numerischen Mathematik / Série Internationale D’Analyse Numérique,"B. I. Penkov, Bl. Sendov",10.1007/978-3-0348-5952-3_12,https://doi.org/10.1007/978-3-0348-5952-3_12,crossref,2025-10-09T13:42:53+00:00
Analysis of Ovulation-Oviposition Patterns in the Domestic Fowl by Telemetry Measurement of Deep Body Temperature,1977,Australian Journal of Biological Sciences,"L Wanda Bobr, BL Sheldon",10.1071/bi9770243,https://doi.org/10.1071/bi9770243,crossref,2025-10-09T13:42:53+00:00
Ultrastruktur der Thyreozyten der Ratte im aliment�ren Tocopherol- und Ubichinonmangel und nach Substitution,1971,Zeitschrift f�r Zellforschung und Mikroskopische Anatomie,"S. Bl�hser, B. Schnorr",10.1007/bf00325636,https://doi.org/10.1007/bf00325636,crossref,2025-10-09T13:42:53+00:00
171. Klinische und arthrographische Nachuntersuchungsergebnisse von Knorpel-Knochen-Wechselplomben und Knorpelklebungen,1980,Langenbecks Archiv f�r Chirurgie,"G. Rupp, G. Bl�mel",10.1007/bf01292134,https://doi.org/10.1007/bf01292134,crossref,2025-10-09T13:42:53+00:00
The physical and neuromotor development of progeny of female rats fed graded levels of pyridoxine during lactation,1978,The American Journal of Clinical Nutrition,"MG Alton-Mackey, BL Walker",10.1093/ajcn/31.1.76,https://doi.org/10.1093/ajcn/31.1.76,crossref,2025-10-09T13:42:53+00:00
"The influence of different mycorrhizae on growth, nutrition and gas-exchange of Pinus mugo seedlings",1974,Plant and Soil,"U. Benecke, F. G�bl",10.1007/bf00011406,https://doi.org/10.1007/bf00011406,crossref,2025-10-09T13:42:53+00:00
Physical and neuromotor development of progeny of pyridoxine-restricted rats cross-fostered with control or isonutritional dams,1978,The American Journal of Clinical Nutrition,"MG Alton-Mackey, BL Walker",10.1093/ajcn/31.2.241,https://doi.org/10.1093/ajcn/31.2.241,crossref,2025-10-09T13:42:53+00:00
Types of urethral catheters for management of short-term voiding problems in hospitalised adults,2008,Cochrane Database of Systematic Reviews,"Katie Schumm, Thomas BL Lam",10.1002/14651858.cd004013.pub3,https://doi.org/10.1002/14651858.cd004013.pub3,crossref,2025-10-09T13:42:53+00:00
Tolerance and dependence induced by morphine-like pituitary peptides in rats,1976,Naunyn-Schmiedeberg's Archives of Pharmacology,"J. Bl�sig, A. Herz",10.1007/bf00508399,https://doi.org/10.1007/bf00508399,crossref,2025-10-09T13:42:53+00:00
Libri Novi,1968,Vegetatio,"Br.-Bl., I. S. Zonneveld",10.1007/bf01956137,https://doi.org/10.1007/bf01956137,crossref,2025-10-09T13:42:53+00:00
"Structural elucidation of antihemorrhage drug molecule Diethylammonium 2,5-dihydroxybenzene sulfonate - an <i>insilico</i> approach",2018,IOP Conference Series: Materials Science and Engineering,"S Anil Kumar, BL Bhaskar",10.1088/1757-899x/310/1/012124,https://doi.org/10.1088/1757-899x/310/1/012124,crossref,2025-10-09T13:42:53+00:00
"Immunoreactive neuropeptide systems in avian embryos (domestic mallard, domestic fowl, Japanese quail)",1982,Cell and Tissue Research,"S. Bl�hser, M. Heinrichs",10.1007/bf01258490,https://doi.org/10.1007/bf01258490,crossref,2025-10-09T13:42:53+00:00
Mechanisms of stick insect locomotion in a gap-crossing paradigm,2004,"Journal of Comparative Physiology A: Sensory, Neural, and Behavioral Physiology","B. Bl�sing, H. Cruse",10.1007/s00359-003-0482-3,https://doi.org/10.1007/s00359-003-0482-3,crossref,2025-10-09T13:42:53+00:00
301. Externe mechanische Herzstimulation durch Druckimpulse,1980,Langenbecks Archiv f�r Chirurgie,"F. C. Himmler, A. Wirtzfeld, W. Erhardt, H. Bl�mer, G. Bl�mel",10.1007/bf01292266,https://doi.org/10.1007/bf01292266,crossref,2025-10-09T13:42:53+00:00
Asset management of transformer based on loss of Life calculation,2016,2016 IEEE 6th International Conference on Power Systems (ICPS),"Paneendra Kumar BL, Roy Mathew",10.1109/icpes.2016.7584000,https://doi.org/10.1109/icpes.2016.7584000,crossref,2025-10-09T13:42:53+00:00
Book reviews,1964,Vegetatio,"Br.-Bl., Hans H. BPfeiffer",10.1007/bf03026057,https://doi.org/10.1007/bf03026057,crossref,2025-10-09T13:42:53+00:00
