title,year,journal,authors,doi,url,source,collected_at
Guide for the use of the International System of Units (SI),1995,,"Barry N Taylor, Barry N Taylor",10.6028/nist.sp.811e1995,https://doi.org/10.6028/nist.sp.811e1995,crossref,2025-10-09T13:42:43+00:00
Venous Thromboembolism Prophylaxis and Wound Healing in Patients Undergoing Major Orthopedic Surgery,2009,Advances in Skin &amp; Wound Care,"Barry J. Snyder, Barry J. Waldman",10.1097/01.asw.0000305485.98734.1f,https://doi.org/10.1097/01.asw.0000305485.98734.1f,crossref,2025-10-09T13:42:43+00:00
Environmental Linkages in Regional Econometric Models: An Analysis of Coal Development in Western Kentucky,1985,Land Economics,"Barry D. Solomon, Barry M. Rubin",10.2307/3146139,https://doi.org/10.2307/3146139,crossref,2025-10-09T13:42:43+00:00
"Uranium in sediments from the Magela Creek catchment, northern territory, Australia",1993,Environmental Technology,"Barry N. Noller, Barry T. Hart",10.1080/09593339309385334,https://doi.org/10.1080/09593339309385334,crossref,2025-10-09T13:42:43+00:00
"Magmatic sedimentation and carbonatitic differentiation in kimberlite sills at Benfontein, South Africa",1973,Journal of the Geological Society,"JOHN BARRY DAWSON, JOHN BARRY HAWTHORNE",10.1144/gsjgs.129.1.0061,https://doi.org/10.1144/gsjgs.129.1.0061,crossref,2025-10-09T13:42:43+00:00
Establishing equality in the articulation process,1992,New Directions for Community Colleges,"Roger J. Barry, Phyllis A. Barry",10.1002/cc.36819927805,https://doi.org/10.1002/cc.36819927805,crossref,2025-10-09T13:42:43+00:00
"""Relationship of perceived maternal acceptance-rejection in childhood and social support networks of pregnant adolescents"": Erratum.",1991,American Journal of Orthopsychiatry,"Barry R. Sherman, Barry R. Donovan",10.1111/j.1939-0025.1991.tb04328.x,https://doi.org/10.1111/j.1939-0025.1991.tb04328.x,crossref,2025-10-09T13:42:43+00:00
Immunosuppressive therapy: Current limitations and future prospects,1994,Perspectives in Drug Discovery and Design,"Barry J. Browne, Barry D. Kahan",10.1007/bf02171735,https://doi.org/10.1007/bf02171735,crossref,2025-10-09T13:42:43+00:00
The Political Culture of Planning,2002,,"J Barry Cullingworth, J. Barry Cullingworth",10.4324/9780203420331,https://doi.org/10.4324/9780203420331,crossref,2025-10-09T13:42:43+00:00
Lemurs in Mangroves and Other Flooded Habitats,2019,Primates in Flooded Habitats,"Giuseppe Donati, Timothy M. Eppley, José Ralison, Jacky Youssouf, Jörg U. Ganzhorn",10.1017/9781316466780.006,https://doi.org/10.1017/9781316466780.006,crossref,2025-10-09T13:42:44+00:00
"ChemInform Abstract: STRUCTURE OF SATRATOXIN H, A METABOLITE OF STACHYBOTRYS ATRA. APPLICATION OF PROTON AND CARBON‐13 NUCLEAR MAGNETIC RESONANCE",1977,Chemischer Informationsdienst,"R. M. EPPLEY, E. P. MAZZOLA, R. J. HIGHET, W. J. BAILEY",10.1002/chin.197723363,https://doi.org/10.1002/chin.197723363,crossref,2025-10-09T13:42:44+00:00
Research investigation into indexes of expertise,1973,R&amp;D Management,"S. G. Barry, S. G. Barry",10.1111/j.1467-9310.1973.tb01044.x,https://doi.org/10.1111/j.1467-9310.1973.tb01044.x,crossref,2025-10-09T13:42:44+00:00
"Structures of satratoxin F and satratoxin G, metabolites of Stachybotrys atra: application of proton and carbon-13 nuclear magnetic resonance spectroscopy",1980,The Journal of Organic Chemistry,"Robert M. Eppley, Eugene P. Mazzola, Michael E. Stack, Peter A. Dreifuss",10.1021/jo01300a058,https://doi.org/10.1021/jo01300a058,crossref,2025-10-09T13:42:44+00:00
Renal Transplantation,1994,Surgical Clinics of North America,"Barry J. Browne, Barry D. Kahan",10.1016/s0039-6109(16)46435-2,https://doi.org/10.1016/s0039-6109(16)46435-2,crossref,2025-10-09T13:42:44+00:00
The use of category information in a memory-search task.,1972,Journal of Experimental Psychology,"Barry L. Lively, Barry J. Sanford",10.1037/h0032492,https://doi.org/10.1037/h0032492,crossref,2025-10-09T13:42:44+00:00
Ribonucleic Acid Synthesis in Experimental Cardiac Hypertrophy in Rats,1968,Circulation Research,"BARRY L. FANBURG, BARRY I. POSNER",10.1161/01.res.23.1.123,https://doi.org/10.1161/01.res.23.1.123,crossref,2025-10-09T13:42:44+00:00
ICON Loop Energy Show Case,2016,Lecture Notes in Computer Science,"Barry Hurley, Barry O’Sullivan, Helmut Simonis",10.1007/978-3-319-50137-6_15,https://doi.org/10.1007/978-3-319-50137-6_15,crossref,2025-10-09T13:42:44+00:00
Reviews,1980,Review of African Political Economy,"Brian Cooksey, Barry Munslow, Barry Munslow",10.1080/03056248008703448,https://doi.org/10.1080/03056248008703448,crossref,2025-10-09T13:42:44+00:00
Cystic Fibrosis Transmembrane Conductance Regulator Modulators: The End of the Beginning,2015,Seminars in Respiratory and Critical Care Medicine,"Peter Barry, Nicola Ronan, Barry Plant",10.1055/s-0035-1546821,https://doi.org/10.1055/s-0035-1546821,crossref,2025-10-09T13:42:44+00:00
Food Habits of Glaucous Gulls in the Beaufort Sea,1990,ARCTIC,"Samuel J. Barry, Thomas W. Barry",10.14430/arctic1589,https://doi.org/10.14430/arctic1589,crossref,2025-10-09T13:42:44+00:00
Introduction / Foreword,2007,Journal of Obstetrics and Gynaecology Canada,"Barry P. Rosen, Barry P. Rosen",10.1016/s1701-2163(16)32487-2,https://doi.org/10.1016/s1701-2163(16)32487-2,crossref,2025-10-09T13:42:44+00:00
Tariff‐jumping foreign direct investment in protectionist era Ireland,2016,The Economic History Review,"Frank Barry, Linda Barry, Aisling Menton",10.1111/ehr.12329,https://doi.org/10.1111/ehr.12329,crossref,2025-10-09T13:42:44+00:00
Survey of Exchange Readership,1980,Exchange: The Organizational Behavior Teaching Journal,"Barry Z. Posner, Barry Z. Posner",10.1177/105256298000500303,https://doi.org/10.1177/105256298000500303,crossref,2025-10-09T13:42:44+00:00
Studies on the mechanism of induced cardiac hypertrophy,1968,The American Journal of Cardiology,"Barry L. Fanburg, Barry I. Posner",10.1016/0002-9149(68)90341-x,https://doi.org/10.1016/0002-9149(68)90341-x,crossref,2025-10-09T13:42:44+00:00
Research investigation into indexes of expertise,1974,R&amp;D Management,"S. G. Barry, S. G. Barry",10.1111/j.1467-9310.1974.tb01064.x,https://doi.org/10.1111/j.1467-9310.1974.tb01064.x,crossref,2025-10-09T13:42:44+00:00
Editorial: A future focus on cystic fibrosis in an era of uncertainty despite opportunity,2021,Current Opinion in Pulmonary Medicine,"Peter J. Barry, Barry J. Plant",10.1097/mcp.0000000000000826,https://doi.org/10.1097/mcp.0000000000000826,crossref,2025-10-09T13:42:44+00:00
The ICON Challenge on Algorithm Selection,2017,AI Magazine,"Lars Kotthoff, Barry Hurley, Barry O'Sullivan",10.1609/aimag.v38i2.2722,https://doi.org/10.1609/aimag.v38i2.2722,crossref,2025-10-09T13:42:44+00:00
Arginine Metabolism in Developing Soybean Cotyledons,1989,Plant Physiology,"Barry J. Micallef, Barry J. Shelp",10.1104/pp.91.1.170,https://doi.org/10.1104/pp.91.1.170,crossref,2025-10-09T13:42:44+00:00
Species Composition and Age Structure of Remains of Hyraxes (Hyracoidea: Procaviidae) at Nests of Black Eagles,1996,Journal of Mammalogy,"Ronald E. Barry, Lisa M. Barry",10.2307/1382674,https://doi.org/10.2307/1382674,crossref,2025-10-09T13:42:44+00:00
Heart Failure in the Elderly,1984,Developments in Cardiovascular Medicine,"Barry L. Kramer, Barry M. Massie",10.1007/978-1-4757-1815-7_3,https://doi.org/10.1007/978-1-4757-1815-7_3,crossref,2025-10-09T13:42:44+00:00
Improvement in exercise hemodynamics and exercise capacity during captopril therapy for chronic heart failure,1982,The American Journal of Cardiology,"Barry Massie, Barry Kramer, Nina Topic",10.1016/0002-9149(82)92358-x,https://doi.org/10.1016/0002-9149(82)92358-x,crossref,2025-10-09T13:42:44+00:00
Personality type and perceived hearing aid benefit revisited,2002,The Hearing Journal,"E. Kimberly Barry, S. Joseph Barry",10.1097/01.hj.0000293293.87003.74,https://doi.org/10.1097/01.hj.0000293293.87003.74,crossref,2025-10-09T13:42:44+00:00
Primary Glaucoma ‐ Criteria for Referral,1969,Clinical and Experimental Optometry,"H. Barry Collin, Barry L. Cole",10.1111/j.1444-0938.1969.tb00550.x,https://doi.org/10.1111/j.1444-0938.1969.tb00550.x,crossref,2025-10-09T13:42:44+00:00
The sexual offender: Not really my type,1995,Sexual Abuse: A Journal of Research and Treatment,"Barry M. Maletzky, Barry M. Maletzky",10.1007/bf02258502,https://doi.org/10.1007/bf02258502,crossref,2025-10-09T13:42:44+00:00
The acute and chronic toxicity of lanthanum to Daphnia carinata,2000,Chemosphere,"Michael J Barry, Barry J Meehan",10.1016/s0045-6535(00)00091-6,https://doi.org/10.1016/s0045-6535(00)00091-6,crossref,2025-10-09T13:42:44+00:00
Do patients with chronic low back pain benefit from attending Pilates classes after completing conventional physiotherapy treatment?,2011,Physiotherapy Practice and Research,"K Quinn, S Barry, L Barry",10.3233/ppr-2011-32102,https://doi.org/10.3233/ppr-2011-32102,crossref,2025-10-09T13:42:44+00:00
The international system of units (SI),1991,,"Barry N Taylor, Barry N Taylor",10.6028/nist.sp.330e1991,https://doi.org/10.6028/nist.sp.330e1991,crossref,2025-10-09T13:42:44+00:00
"Editorial: The changing landscape of cystic fibrosis: new therapies, challenges and a global pandemic",2020,Current Opinion in Pulmonary Medicine,"Peter J. Barry, Barry J. Plant",10.1097/mcp.0000000000000734,https://doi.org/10.1097/mcp.0000000000000734,crossref,2025-10-09T13:42:44+00:00
Arginine Metabolism in Developing Soybean Cotyledons,1989,Plant Physiology,"Barry J. Micallef, Barry J. Shelp",10.1104/pp.90.2.631,https://doi.org/10.1104/pp.90.2.631,crossref,2025-10-09T13:42:44+00:00
The effect of oestrogen on the female cardiovascular system,1992,Medical Journal of Australia,"Barry G Wren, Barry G Wren",10.5694/j.1326-5377.1992.tb137091.x,https://doi.org/10.5694/j.1326-5377.1992.tb137091.x,crossref,2025-10-09T13:42:44+00:00
Sequential morphological changes at the site of carotid endarterectomy,1974,Journal of Neurosurgery,"Barry N. French, N. Barry Rewcastle",10.3171/jns.1974.41.6.0745,https://doi.org/10.3171/jns.1974.41.6.0745,crossref,2025-10-09T13:42:44+00:00
A Maintenance Assessment Case Study*,2023,Asset Management Excellence,"Don M. Barry, Don M. Barry",10.1201/9781032679600-16,https://doi.org/10.1201/9781032679600-16,crossref,2025-10-09T13:42:44+00:00
Effects of Drugs of Abuse on Brain Development,2011,Neurobiology of Mental Illness,"Barry M. Lester, Barry E. Kosofsky",10.1093/med/9780199798261.003.0048,https://doi.org/10.1093/med/9780199798261.003.0048,crossref,2025-10-09T13:42:44+00:00
How Are Resistant Strains of Staphylococcus aureus Acquired in the Community?,1990,Scandinavian Journal of Infectious Diseases,"Barry S. Peters, Barry D. Cookson",10.3109/00365549009027139,https://doi.org/10.3109/00365549009027139,crossref,2025-10-09T13:42:44+00:00
Heart Failure With Preserved &amp;#x2028;Ejection Fraction,2024,Mayo Clinic Cardiology,"Barry A. Borlaug, Barry A. Boilson",10.1093/med/9780197599532.003.0089,https://doi.org/10.1093/med/9780197599532.003.0089,crossref,2025-10-09T13:42:44+00:00
Ribonucleic Acid Synthesis in Experimental Cardiac Hypertrophy in Rats,1968,Circulation Research,"BARRY I. POSNER, BARRY L. FANBURG",10.1161/01.res.23.1.137,https://doi.org/10.1161/01.res.23.1.137,crossref,2025-10-09T13:42:44+00:00
Introduction | Foreword,2008,Journal of Obstetrics and Gynaecology Canada,"Barry P. Rosen, Barry P. Rosen",10.1016/s1701-2163(16)32842-0,https://doi.org/10.1016/s1701-2163(16)32842-0,crossref,2025-10-09T13:42:44+00:00
Mortality Rates of Persons Entering Methadone Maintenance: A Seven-Year Study,1979,The American Journal of Drug and Alcohol Abuse,"Barry Concool, Harry Smith, Barry Stimmel",10.3109/00952997909001723,https://doi.org/10.3109/00952997909001723,crossref,2025-10-09T13:42:44+00:00
Female employment in the multinational electronics industry in Ireland's south-west planning region,2014,Irish Geography,"Almar M. Barry, Barry M. Brunt",10.55650/igj.2002.245,https://doi.org/10.55650/igj.2002.245,crossref,2025-10-09T13:42:44+00:00
"Review: Cannabinoids and codeine have similar effects on pain relief, but cannabinoids commonly cause adverse psychotropic effects",2002,ACP Journal Club,"Barry M. Kinzbrunner, Barry M. Kinzbrunner",10.7326/acpjc-2002-136-1-018,https://doi.org/10.7326/acpjc-2002-136-1-018,crossref,2025-10-09T13:42:44+00:00
Technological Aspects of Recording Evoked Potentials from the Cauda Equina and Lumbosacral Spinal Cord in Man,1979,American Journal of EEG Technology,"W. Barry McKay, Barry L. Galloway",10.1080/00029238.1979.11079968,https://doi.org/10.1080/00029238.1979.11079968,crossref,2025-10-09T13:42:44+00:00
Becoming a Rural Teacher,2020,Teaching in Rural Places,"Amy Price Azano, Devon Brenner, Jayne Downey, Karen Eppley, Ann K. Schulte",10.4324/9781003106357-1,https://doi.org/10.4324/9781003106357-1,crossref,2025-10-09T13:42:44+00:00
"Structure of Satratoxin H, a metabolite of Stachybotrys atra. Application of proton and carbon-13 nuclear magnetic resonance",1977,The Journal of Organic Chemistry,"Robert M. Eppley, Eugene P. Mazzola, Robert J. Highet, William J. Bailey",10.1021/jo00422a014,https://doi.org/10.1021/jo00422a014,crossref,2025-10-09T13:42:44+00:00
Thriving as a Rural Teacher,2020,Teaching in Rural Places,"Amy Price Azano, Devon Brenner, Jayne Downey, Karen Eppley, Ann K. Schulte",10.4324/9781003106357-19,https://doi.org/10.4324/9781003106357-19,crossref,2025-10-09T13:42:44+00:00
"ChemInform Abstract: STRUCTURES OF SATRATOXIN F AND SATRATOXIN G, METABOLITES OF STACHYBOTRYS ATRA: APPLICATION OF PROTON AND CARBON‐13 NUCLEAR MAGNETIC RESONANCE SPECTROSCOPY",1980,Chemischer Informationsdienst,"R. M. EPPLEY, E. P. MAZZOLA, M. E. STACK, P. A. DREIFUSS",10.1002/chin.198044317,https://doi.org/10.1002/chin.198044317,crossref,2025-10-09T13:42:44+00:00
"Military Psychology Students: Contributions, Pathways, and Opportunities",2017,Handbook of Military Psychology,"Jennifer A. Barry, David M. Barry",10.1007/978-3-319-66192-6_23,https://doi.org/10.1007/978-3-319-66192-6_23,crossref,2025-10-09T13:42:44+00:00
Interpretation of the SI for the United States and metric conversion policy for federal agencies,1991,,"Barry N Taylor, Barry N Taylor",10.6028/nist.sp.814,https://doi.org/10.6028/nist.sp.814,crossref,2025-10-09T13:42:44+00:00
DEPENDENCY IN ADULT PATIENTS FOLLOWING EARLY MATERNAL BEREAVEMENT,1965,The Journal of Nervous and Mental Disease,"HERBERT BARRY, HERBERT BARRY, ERICH LINDEMANN",10.1097/00005053-196503000-00004,https://doi.org/10.1097/00005053-196503000-00004,crossref,2025-10-09T13:42:44+00:00
Energy Management Systems,2022,Proceedings of 2022 AOCS Annual Meeting &amp; Expo,John Barry,10.21748/xwwi2567,https://doi.org/10.21748/xwwi2567,crossref,2025-10-09T13:42:44+00:00
Arginine Metabolism in Developing Soybean Cotyledons,1989,Plant Physiology,"Barry J. Micallef, Barry J. Shelp",10.1104/pp.90.2.624,https://doi.org/10.1104/pp.90.2.624,crossref,2025-10-09T13:42:44+00:00
Interpretation of the SI for the United States and federal government metric conversion policy,1998,,"Barry N Taylor, Barry N Taylor",10.6028/nist.sp.814e1998,https://doi.org/10.6028/nist.sp.814e1998,crossref,2025-10-09T13:42:44+00:00
The international system of units (SI),2008,,"Barry N Taylor, Barry N Taylor",10.6028/nist.sp.330e2008,https://doi.org/10.6028/nist.sp.330e2008,crossref,2025-10-09T13:42:44+00:00
Female employment in the multinational electronics industry in Ireland's south‐west planning region,2002,Irish Geography,"Almar M. Barry, Barry M. Brunt",10.1080/00750770209555791,https://doi.org/10.1080/00750770209555791,crossref,2025-10-09T13:42:44+00:00
Economic and fiscal impact analysis of energy development projects: Coal liquefaction in the Illinois Basin,1983,Socio-Economic Planning Sciences,"Barry M. Rubin, Barry D. Solomon",10.1016/0038-0121(83)90003-4,https://doi.org/10.1016/0038-0121(83)90003-4,crossref,2025-10-09T13:42:44+00:00
Understanding Rural Places,2020,Teaching in Rural Places,"Amy Price Azano, Devon Brenner, Jayne Downey, Karen Eppley, Ann K. Schulte",10.4324/9781003106357-3,https://doi.org/10.4324/9781003106357-3,crossref,2025-10-09T13:42:44+00:00
Microbial sources of exocellular DNA in the ocean,2021,,"Morgan Linney, John Eppley, Anna Romano, Elaine Luo, Edward DeLong, David Karl",10.21203/rs.3.rs-431074/v1,https://doi.org/10.21203/rs.3.rs-431074/v1,crossref,2025-10-09T13:42:44+00:00
Computability Theory,2017,,"S. Barry Cooper, S. Barry Cooper",10.1201/9781315275789,https://doi.org/10.1201/9781315275789,crossref,2025-10-09T13:42:44+00:00
Stereolithographic Biomodelling in Cranio-maxillofacial Surgery,1999,Journal of Craniofacial Surgery,"Barry L. Eppley, P. S. DʼUrso, T. M. Barker, W. J. Eurwaker, L. J. Bruce, R. L. Atkinson, M. W. Lanigan, J. F. Arvier, D. J. Effeney",10.1097/00001665-199909000-00017,https://doi.org/10.1097/00001665-199909000-00017,crossref,2025-10-09T13:42:44+00:00
Why Place Matters,2020,Teaching in Rural Places,"Amy Price Azano, Devon Brenner, Jayne Downey, Karen Eppley, Ann K. Schulte",10.4324/9781003106357-4,https://doi.org/10.4324/9781003106357-4,crossref,2025-10-09T13:42:44+00:00
Responding to Trauma,2020,Teaching in Rural Places,"Amy Price Azano, Devon Brenner, Jayne Downey, Karen Eppley, Ann K. Schulte",10.4324/9781003106357-11,https://doi.org/10.4324/9781003106357-11,crossref,2025-10-09T13:42:44+00:00
"Transition metal Kinamycin model as a DNA photocleaver for hypoxic environments: bis(9-diazo-4,5-diazafluorene)copper(II) nitrate†",1999,Chemical Communications,"Hilary J. Eppley, Susan M. Lato, Jeffrey M. Zaleski, Andrew D. Ellington",10.1039/a906764g,https://doi.org/10.1039/a906764g,crossref,2025-10-09T13:42:44+00:00
Investigation of edge tracking via image subtraction for refractive index structure parameter estimation,2023,Laser Communication and Propagation through the Atmosphere and Oceans XII,"Anthony Eppley, Matthew B. Salfer-Hobbs, Thomas J. Miletich, Robert F. Crabbs",10.1117/12.2677641,https://doi.org/10.1117/12.2677641,crossref,2025-10-09T13:42:44+00:00
Follow Family-Focused Care Principles,1999,Nursing Management (Springhouse),"DONNA APPIER CROMPTON, REBECCA MAISENBACHER ROTH, GLORIA YORK EPPLEY, CELESTE R. PHILLIPS",10.1097/00006247-199902000-00016,https://doi.org/10.1097/00006247-199902000-00016,crossref,2025-10-09T13:42:44+00:00
Microbial community phylogenetic and trait diversity declines with depth in a marine oxygen minimum zone,2012,Ecology,"Jessica A. Bryant, Frank J. Stewart, John M. Eppley, Edward F. DeLong",10.1890/11-1204.1,https://doi.org/10.1890/11-1204.1,crossref,2025-10-09T13:42:44+00:00
Families as Partners in Rural Communities,2020,Teaching in Rural Places,"Amy Price Azano, Devon Brenner, Jayne Downey, Karen Eppley, Ann K. Schulte",10.4324/9781003106357-7,https://doi.org/10.4324/9781003106357-7,crossref,2025-10-09T13:42:44+00:00
Ammonium distribution in southern California coastal waters and its role in the growth of phytoplankton1,1979,Limnology and Oceanography,"Richard W. Eppley, E. H. Render, W. G. Harrison, J. J. Cullen",10.4319/lo.1979.24.3.0495,https://doi.org/10.4319/lo.1979.24.3.0495,crossref,2025-10-09T13:42:44+00:00
Cu(II)-Mediated Intramolecular Carbene Cation Radical Formation:  Relevance to Unimolecular Metal−Ligand Radical Intermediates,2001,Journal of the American Chemical Society,"Brian J. Kraft, Hilary J. Eppley, John C. Huffman, Jeffrey M. Zaleski",10.1021/ja0120072,https://doi.org/10.1021/ja0120072,crossref,2025-10-09T13:42:44+00:00
Building Professional Networks in Rural Schools,2020,Teaching in Rural Places,"Amy Price Azano, Devon Brenner, Jayne Downey, Karen Eppley, Ann K. Schulte",10.4324/9781003106357-9,https://doi.org/10.4324/9781003106357-9,crossref,2025-10-09T13:42:44+00:00
Technology for Learning in the Rural Classroom,2020,Teaching in Rural Places,"Amy Price Azano, Devon Brenner, Jayne Downey, Karen Eppley, Ann K. Schulte",10.4324/9781003106357-14,https://doi.org/10.4324/9781003106357-14,crossref,2025-10-09T13:42:44+00:00
Crush Injuries to the Head in Children,1995,Neurosurgery,"Ann-Christine Duhaime, Matthew Eppley, Susan Margulies, Katrinka L. Heher, Scott P. Bartlett",10.1097/00006123-199509000-00005,https://doi.org/10.1097/00006123-199509000-00005,crossref,2025-10-09T13:42:44+00:00
"Technical-Economic Study of the Photovoltaic Pumping System and Generator of the Madinah Village in Dabola, Republic of Guinea&amp;lt;br /&amp;gt; &amp;lt;div&amp;gt;  &amp;lt;br /&amp;gt; &amp;lt;/div&amp;gt;",2023,International Journal of Energy and Power Engineering,"Ansoumane Sakouvogui, Saïdou Barry, Hamidou Barry, Thierno Amadou Barry, Mamby Keita",10.11648/j.ijepe.20231205.11,https://doi.org/10.11648/j.ijepe.20231205.11,crossref,2025-10-09T13:42:44+00:00
TLC and HPLC methods for analysis of trichothecenes in commodities,1986,Diagnosis of Mycotoxicoses,"A. E. Pohland, C. W. Thorpe, M. W. Trucksess, R. M. Eppley",10.1007/978-94-009-4235-6_23,https://doi.org/10.1007/978-94-009-4235-6_23,crossref,2025-10-09T13:42:44+00:00
Genetic Exchange Across a Species Boundary in the Archaeal Genus Ferroplasma,2007,Genetics,"John M Eppley, Gene W Tyson, Wayne M Getz, Jillian F Banfield",10.1534/genetics.107.072892,https://doi.org/10.1534/genetics.107.072892,crossref,2025-10-09T13:42:44+00:00
Teaching as Inquiry: What Works in Rural Classrooms,2020,Teaching in Rural Places,"Amy Price Azano, Devon Brenner, Jayne Downey, Karen Eppley, Ann K. Schulte",10.4324/9781003106357-18,https://doi.org/10.4324/9781003106357-18,crossref,2025-10-09T13:42:44+00:00
A high power cross-field amplifier at X-band,,Conference Record of the 1991 IEEE Particle Accelerator Conference,"K. Eppley, J. Feinstein, K. Ko, N. Kroll, T. Lee, E. Nelson",10.1109/pac.1991.164418,https://doi.org/10.1109/pac.1991.164418,crossref,2025-10-09T13:42:44+00:00
Perseverance and food sharing among closely affiliated female chimpanzees,2013,Primates,"Timothy M. Eppley, Malini Suchak, Jen Tinsman, Frans B. M. de Waal",10.1007/s10329-013-0374-2,https://doi.org/10.1007/s10329-013-0374-2,crossref,2025-10-09T13:42:44+00:00
Biological nitrogen cycling in the nitracline,1989,Limnology and Oceanography,"B. B. Ward, K. A. Kilpatrick, E. H. Renger, R. W. Eppley",10.4319/lo.1989.34.3.0493,https://doi.org/10.4319/lo.1989.34.3.0493,crossref,2025-10-09T13:42:44+00:00
Limits to Sexual Reproduction in Geothermal Bryophytes,2011,International Journal of Plant Sciences,"Sarah M. Eppley, Todd N. Rosenstiel, Camille B. Graves, Estefanía Llaneza García",10.1086/660884,https://doi.org/10.1086/660884,crossref,2025-10-09T13:42:44+00:00
The Global Ocean Flux Study (GOFS): Status of the U.S. GOFS Program,1986,"Eos, Transactions American Geophysical Union","P. G. Brewer, K. W. Bruland, R. W. Eppley, J. J. McCarthy",10.1029/eo067i044p00827,https://doi.org/10.1029/eo067i044p00827,crossref,2025-10-09T13:42:44+00:00
"Isolation and identification of xanthomegnin, viomellein, rubrosulphin, and viopurpurin as metabolites of penicillium viridicatum",1977,Applied and Environmental Microbiology,"M E Stack, R M Eppley, P A Dreifuss, A E Pohland",10.1128/aem.33.2.351-355.1977,https://doi.org/10.1128/aem.33.2.351-355.1977,crossref,2025-10-09T13:42:44+00:00
Crush Injuries to the Head in Children,1995,Neurosurgery,"Ann-Christine Duhaime, Matthew Eppley, Susan Margulies, Katrinka L. Heher, Scott P. Bartlett",10.1227/00006123-199509000-00005,https://doi.org/10.1227/00006123-199509000-00005,crossref,2025-10-09T13:42:44+00:00
Using Lean Startup to Discover Customers in the mHealth Industry: Current Landscape and Challenges,2021,Journal of Commercial Biotechnology,"Hannah B. Eppley, Waymond Zhou, Grant Alexander Wilson, Michael Toscani, John M. York",10.5912/jcb1015,https://doi.org/10.5912/jcb1015,crossref,2025-10-09T13:42:44+00:00
"The Evolution of the Utraquist Mass, 1420-1620",2006,The Catholic Historical Review,Barry F. H. (Barry Frederic Hunter) Graham,10.1353/cat.2007.0021,https://doi.org/10.1353/cat.2007.0021,crossref,2025-10-09T13:42:44+00:00
LEMUR FOOD PLANTS,2022,The New Natural History of Madagascar,"T. M. Eppley, K. J. E. Steffens, I. C. Colquhoun, C. R. Birkinshaw",10.2307/j.ctv2ks6tbb.255,https://doi.org/10.2307/j.ctv2ks6tbb.255,crossref,2025-10-09T13:42:44+00:00
Aircraft Dynamic Modes of a Winged Reusable Rocket Plane,2013,AIAA SPACE 2013 Conference and Exposition,"Barry M. Hellman, Barry Pleiman, Mark Street",10.2514/6.2013-5531,https://doi.org/10.2514/6.2013-5531,crossref,2025-10-09T13:42:44+00:00
Useful Explanations,2003,Lecture Notes in Computer Science,"Barry O’Callaghan, Eugene C. Freuder, Barry O’Sullivan",10.1007/978-3-540-45193-8_112,https://doi.org/10.1007/978-3-540-45193-8_112,crossref,2025-10-09T13:42:44+00:00
Quantum partially observable Markov decision processes,2014,Physical Review A,"Jennifer Barry, Daniel T. Barry, Scott Aaronson",10.1103/physreva.90.032311,https://doi.org/10.1103/physreva.90.032311,crossref,2025-10-09T13:42:44+00:00
Cephalometric Analysis for Mandibular Surgery,1982,Plastic and Reconstructive Surgery,"Barry Zide, Barry Grayson, Joseph G. McCarthy",10.1097/00006534-198201000-00030,https://doi.org/10.1097/00006534-198201000-00030,crossref,2025-10-09T13:42:44+00:00
Notes on Romantic Orientation,2022,Encyclopedia of Sexuality and Gender,"Caitlin Barry, Jacob Barry, Meredith L. Chivers",10.1007/978-3-319-59531-3_104-1,https://doi.org/10.1007/978-3-319-59531-3_104-1,crossref,2025-10-09T13:42:44+00:00
Cephalometric Analysis for Upper and Lower Midface Surgery,1981,Plastic and Reconstructive Surgery,"Barry Zide, Barry Grayson, Joseph G. McCarthy",10.1097/00006534-198112000-00026,https://doi.org/10.1097/00006534-198112000-00026,crossref,2025-10-09T13:42:44+00:00
