title,year,journal,authors,doi,url,source,collected_at
Georgia,2012,The Statesman’s Yearbook,Barry Turner,10.1007/978-1-349-59541-9_222,https://doi.org/10.1007/978-1-349-59541-9_222,crossref,2025-10-09T13:42:45+00:00
Central American Common Market (CACM),2012,The Statesman’s Yearbook,Barry Turner,10.1007/978-1-349-59541-9_81,https://doi.org/10.1007/978-1-349-59541-9_81,crossref,2025-10-09T13:42:45+00:00
Macedonia,2012,The Statesman’s Yearbook,Barry Turner,10.1007/978-1-349-59541-9_261,https://doi.org/10.1007/978-1-349-59541-9_261,crossref,2025-10-09T13:42:45+00:00
Central Bank of West African States (BCEAO),2012,The Statesman’s Yearbook,Barry Turner,10.1007/978-1-349-59541-9_62,https://doi.org/10.1007/978-1-349-59541-9_62,crossref,2025-10-09T13:42:45+00:00
Mauritania,2010,The Statesman’s Yearbook,Barry Turner,10.1007/978-1-349-58635-6_218,https://doi.org/10.1007/978-1-349-58635-6_218,crossref,2025-10-09T13:42:45+00:00
Agency for the Prohibition of Nuclear Weapons in Latin America and the Caribbean (OPANAL),2008,The Statesman’s Yearbook,Barry Turner,10.1007/978-1-349-74027-7_75,https://doi.org/10.1007/978-1-349-74027-7_75,crossref,2025-10-09T13:42:45+00:00
South Asian Association for Regional Co-operation (SAARC),2009,The Statesman’s Yearbook 2010,Barry Turner,10.1007/978-1-349-58632-5_99,https://doi.org/10.1007/978-1-349-58632-5_99,crossref,2025-10-09T13:42:45+00:00
Micronesia,2009,The Statesman’s Yearbook 2010,Barry Turner,10.1007/978-1-349-58632-5_223,https://doi.org/10.1007/978-1-349-58632-5_223,crossref,2025-10-09T13:42:45+00:00
Bosnia and Herzegovina,2009,The Statesman’s Yearbook 2010,Barry Turner,10.1007/978-1-349-58632-5_131,https://doi.org/10.1007/978-1-349-58632-5_131,crossref,2025-10-09T13:42:45+00:00
Senegal,2012,The Statesman’s Yearbook,Barry Turner,10.1007/978-1-349-59541-9_310,https://doi.org/10.1007/978-1-349-59541-9_310,crossref,2025-10-09T13:42:45+00:00
Southern African Customs Union (SACU),2009,The Statesman’s Yearbook 2010,Barry Turner,10.1007/978-1-349-58632-5_71,https://doi.org/10.1007/978-1-349-58632-5_71,crossref,2025-10-09T13:42:45+00:00
Australia,2012,The Statesman’s Yearbook,Barry Turner,10.1007/978-1-349-59541-9_168,https://doi.org/10.1007/978-1-349-59541-9_168,crossref,2025-10-09T13:42:45+00:00
Organization of the Petroleum Exporting Countries (OPEC),2010,The Statesman’s Yearbook,Barry Turner,10.1007/978-1-349-58635-6_106,https://doi.org/10.1007/978-1-349-58635-6_106,crossref,2025-10-09T13:42:45+00:00
Union of South American Nations (UNASUR),2010,The Statesman’s Yearbook,Barry Turner,10.1007/978-1-349-58635-6_91,https://doi.org/10.1007/978-1-349-58635-6_91,crossref,2025-10-09T13:42:45+00:00
Madagascar,2005,The Statesman’s Yearbook,Barry Turner,10.1057/9780230271340_213,https://doi.org/10.1057/9780230271340_213,crossref,2025-10-09T13:42:45+00:00
Rethinking Mis/Behaviour in Schools: From ‘Youth as a Problem’ to the ‘Relational School’,2016,Challenging Dominant Views on Student Behaviour at School,Barry Down,10.1007/978-981-10-0628-9_6,https://doi.org/10.1007/978-981-10-0628-9_6,crossref,2025-10-09T13:42:45+00:00
Madagascar,2011,The Statesman’s Yearbook,Barry Turner,10.1007/978-1-349-59051-3_260,https://doi.org/10.1007/978-1-349-59051-3_260,crossref,2025-10-09T13:42:45+00:00
Organisation for Economic Co-operation and Development (OECD),2009,The Statesman’s Yearbook 2010,Barry Turner,10.1007/978-1-349-58632-5_51,https://doi.org/10.1007/978-1-349-58632-5_51,crossref,2025-10-09T13:42:45+00:00
Iran,2009,The Statesman’s Yearbook 2010,Barry Turner,10.1007/978-1-349-58632-5_188,https://doi.org/10.1007/978-1-349-58632-5_188,crossref,2025-10-09T13:42:45+00:00
Afghanistan,2004,The Statesman’s Yearbook 2005,Barry Turner,10.1057/9780230271333_106,https://doi.org/10.1057/9780230271333_106,crossref,2025-10-09T13:42:45+00:00
Monaco,2006,The Statesman’s Yearbook 2007,Barry Turner,10.1057/9780230271357_227,https://doi.org/10.1057/9780230271357_227,crossref,2025-10-09T13:42:45+00:00
Mexico,2005,The Statesman’s Yearbook,Barry Turner,10.1057/9780230271340_222,https://doi.org/10.1057/9780230271340_222,crossref,2025-10-09T13:42:46+00:00
Lithuania,2006,The Statesman’s Yearbook 2007,Barry Turner,10.1057/9780230271357_212,https://doi.org/10.1057/9780230271357_212,crossref,2025-10-09T13:42:46+00:00
Organization of the Islamic Conference (OIC),2004,The Statesman’s Yearbook 2005,Barry Turner,10.1057/9780230271333_89,https://doi.org/10.1057/9780230271333_89,crossref,2025-10-09T13:42:46+00:00
Brunei,2004,The Statesman’s Yearbook 2005,Barry Turner,10.1057/9780230271333_130,https://doi.org/10.1057/9780230271333_130,crossref,2025-10-09T13:42:46+00:00
Intergovernmental Authority on Development,2006,The Statesman’s Yearbook 2007,Barry Turner,10.1057/9780230271357_71,https://doi.org/10.1057/9780230271357_71,crossref,2025-10-09T13:42:46+00:00
Germany,2004,The Statesman’s Yearbook 2005,Barry Turner,10.1057/9780230271333_170,https://doi.org/10.1057/9780230271333_170,crossref,2025-10-09T13:42:46+00:00
Mauritius,2006,The Statesman’s Yearbook 2007,Barry Turner,10.1057/9780230271357_223,https://doi.org/10.1057/9780230271357_223,crossref,2025-10-09T13:42:46+00:00
The Commonwealth,2004,The Statesman’s Yearbook 2005,Barry Turner,10.1057/9780230271333_28,https://doi.org/10.1057/9780230271333_28,crossref,2025-10-09T13:42:46+00:00
St Vincent and the Grenadines,2004,The Statesman’s Yearbook 2005,Barry Turner,10.1057/9780230271333_251,https://doi.org/10.1057/9780230271333_251,crossref,2025-10-09T13:42:46+00:00
San Marino,2006,The Statesman’s Yearbook 2007,Barry Turner,10.1057/9780230271357_259,https://doi.org/10.1057/9780230271357_259,crossref,2025-10-09T13:42:46+00:00
Croatia,2006,The Statesman’s Yearbook 2007,Barry Turner,10.1057/9780230271357_154,https://doi.org/10.1057/9780230271357_154,crossref,2025-10-09T13:42:46+00:00
Chile,2006,The Statesman’s Yearbook 2007,Barry Turner,10.1057/9780230271357_146,https://doi.org/10.1057/9780230271357_146,crossref,2025-10-09T13:42:46+00:00
Senegal,2006,The Statesman’s Yearbook 2007,Barry Turner,10.1057/9780230271357_262,https://doi.org/10.1057/9780230271357_262,crossref,2025-10-09T13:42:46+00:00
Sweden,2006,The Statesman’s Yearbook 2007,Barry Turner,10.1057/9780230271357_277,https://doi.org/10.1057/9780230271357_277,crossref,2025-10-09T13:42:46+00:00
Mongolia,2006,The Statesman’s Yearbook 2007,Barry Turner,10.1057/9780230271357_228,https://doi.org/10.1057/9780230271357_228,crossref,2025-10-09T13:42:46+00:00
Nordic Development Fund (NDF),2006,The Statesman’s Yearbook 2007,Barry Turner,10.1057/9780230271357_22,https://doi.org/10.1057/9780230271357_22,crossref,2025-10-09T13:42:46+00:00
International Organization for Migration (IOM),2005,The Statesman’s Yearbook,Barry Turner,10.1057/9780230271340_38,https://doi.org/10.1057/9780230271340_38,crossref,2025-10-09T13:42:46+00:00
Médecins sans Frontières (MSF),2006,The Statesman’s Yearbook 2007,Barry Turner,10.1057/9780230271357_51,https://doi.org/10.1057/9780230271357_51,crossref,2025-10-09T13:42:46+00:00
Union of South American Nations (UNASUR),2011,The Statesman’s Yearbook,Barry Turner,10.1007/978-1-349-59051-3_90,https://doi.org/10.1007/978-1-349-59051-3_90,crossref,2025-10-09T13:42:46+00:00
Kenya,2011,The Statesman’s Yearbook,Barry Turner,10.1007/978-1-349-59051-3_244,https://doi.org/10.1007/978-1-349-59051-3_244,crossref,2025-10-09T13:42:46+00:00
Latin American Reserve Fund,2011,The Statesman’s Yearbook,Barry Turner,10.1007/978-1-349-59051-3_85,https://doi.org/10.1007/978-1-349-59051-3_85,crossref,2025-10-09T13:42:46+00:00
European Broadcasting Union (EBU),2011,The Statesman’s Yearbook,Barry Turner,10.1007/978-1-349-59051-3_22,https://doi.org/10.1007/978-1-349-59051-3_22,crossref,2025-10-09T13:42:46+00:00
Organization of the Islamic Conference (OIC),2011,The Statesman’s Yearbook,Barry Turner,10.1007/978-1-349-59051-3_51,https://doi.org/10.1007/978-1-349-59051-3_51,crossref,2025-10-09T13:42:46+00:00
Centre for Independent Studies,2011,The Statesman’s Yearbook,Barry Turner,10.1007/978-1-349-59051-3_122,https://doi.org/10.1007/978-1-349-59051-3_122,crossref,2025-10-09T13:42:46+00:00
Black Sea Economic Cooperation (BSEC),2011,The Statesman’s Yearbook,Barry Turner,10.1007/978-1-349-59051-3_23,https://doi.org/10.1007/978-1-349-59051-3_23,crossref,2025-10-09T13:42:46+00:00
Owl,2003,Oxford Music Online,Barry Kernfeld,10.1093/gmo/9781561592630.article.j342100,https://doi.org/10.1093/gmo/9781561592630.article.j342100,crossref,2025-10-09T13:42:46+00:00
"Chéreau, Patrice (opera)",2002,Oxford Music Online,Barry Millington,10.1093/gmo/9781561592630.article.o003523,https://doi.org/10.1093/gmo/9781561592630.article.o003523,crossref,2025-10-09T13:42:46+00:00
"Strategy and Human Resource Management, 2 edition, by Peter Boxall and John Purcell, New York: Palgrave MacMillan, 2008, 351 pp., ISBN 978-1-403992-10-9.",2008,Relations industrielles,Barry Plumb,10.7202/019105ar,https://doi.org/10.7202/019105ar,crossref,2025-10-09T13:42:46+00:00
Industrialization and Economic Development: The Costs to Women,1996,Vietnam’s Women in Transition,Kathleen Barry,10.1007/978-1-349-24611-3_10,https://doi.org/10.1007/978-1-349-24611-3_10,crossref,2025-10-09T13:42:46+00:00
The Voices of Extremist Violence: What Can We Hear?,2015,"Media, Margins and Civic Agency",Barry Richards,10.1057/9781137512642_5,https://doi.org/10.1057/9781137512642_5,crossref,2025-10-09T13:42:46+00:00
The State,2000,An Introduction to Modern Political Theory,Norman Barry,10.1007/978-1-137-26641-5_3,https://doi.org/10.1007/978-1-137-26641-5_3,crossref,2025-10-09T13:42:46+00:00
The Special Case of Nuclear Proliferation,1987,An Introduction to Strategic Studies,Barry Buzan,10.1007/978-1-349-18796-6_4,https://doi.org/10.1007/978-1-349-18796-6_4,crossref,2025-10-09T13:42:46+00:00
Summary and Conclusions,1987,An Introduction to Strategic Studies,Barry Buzan,10.1007/978-1-349-18796-6_18,https://doi.org/10.1007/978-1-349-18796-6_18,crossref,2025-10-09T13:42:46+00:00
Popular Islam and Official Ulama,1990,Islamic Fundamentalism in Egyptian Politics,Barry Rubin,10.1007/978-1-349-21093-0_7,https://doi.org/10.1007/978-1-349-21093-0_7,crossref,2025-10-09T13:42:46+00:00
The Electrogeometrical Model of the Rolling Sphere Method [History],2016,IEEE Industry Applications Magazine,Barry Brusso,10.1109/mias.2015.2503940,https://doi.org/10.1109/mias.2015.2503940,crossref,2025-10-09T13:42:46+00:00
"Hicks, Haecs, Hocs: Diaries of a Good Bishop",1998,New Blackfriars,Barry Baldwin,10.1111/j.1741-2005.1998.tb01608.x,https://doi.org/10.1111/j.1741-2005.1998.tb01608.x,crossref,2025-10-09T13:42:46+00:00
Book review: Toward Awakening an Approach to the Teaching Left by Gurdjieff,1980,PsycEXTRA Dataset,Barry McWaters,10.1037/e511992011-014,https://doi.org/10.1037/e511992011-014,crossref,2025-10-09T13:42:46+00:00
Caring for the Caregivers,2014,PsycEXTRA Dataset,Barry Jacobs,10.1037/e651052013-062,https://doi.org/10.1037/e651052013-062,crossref,2025-10-09T13:42:46+00:00
Recognizing ingroup and outgroup members: The influence of perceptual salience,2005,PsycEXTRA Dataset,Barry Corenblum,10.1037/e633942013-112,https://doi.org/10.1037/e633942013-112,crossref,2025-10-09T13:42:46+00:00
Living with Spinal Cord Injury Series,1973,PsycEXTRA Dataset,Barry Corbet,10.1037/e503162006-001,https://doi.org/10.1037/e503162006-001,crossref,2025-10-09T13:42:46+00:00
Diagnostic radiology*,1964,Australian Dental Journal,Barry Fitzpatrick,10.1111/j.1834-7819.1964.tb02092.x,https://doi.org/10.1111/j.1834-7819.1964.tb02092.x,crossref,2025-10-09T13:42:46+00:00
Introduction To Race Relations,2003,,Barry Troyna,10.4324/9780203215197,https://doi.org/10.4324/9780203215197,crossref,2025-10-09T13:42:46+00:00
Manual of anaesthesia,2006,Critical Care and Resuscitation,Barry Lim,10.1016/s1441-2772(23)02114-2,https://doi.org/10.1016/s1441-2772(23)02114-2,crossref,2025-10-09T13:42:46+00:00
Automation and Decision Making—Lessons from the Cali Accident,1997,Proceedings of the Human Factors and Ergonomics Society Annual Meeting,Barry Strauch,10.1177/107118139704100145,https://doi.org/10.1177/107118139704100145,crossref,2025-10-09T13:42:46+00:00
The Non-Arab Third World and Antisemitism,1990,Anti-Zionism and Antisemitism in the Contemporary World,Barry Rubin,10.1007/978-1-349-11262-3_8,https://doi.org/10.1007/978-1-349-11262-3_8,crossref,2025-10-09T13:42:46+00:00
Introduction,2007,See the Virgin Blest,Barry Spurr,10.1007/978-1-137-12140-0_1,https://doi.org/10.1007/978-1-137-12140-0_1,crossref,2025-10-09T13:42:46+00:00
Letter to the Editor,1995,International Journal of Sport Nutrition,Barry Braun,10.1123/ijsn.5.2.165,https://doi.org/10.1123/ijsn.5.2.165,crossref,2025-10-09T13:42:46+00:00
manceps,2016,Oxford Research Encyclopedia of Classics,Barry Nicholas,10.1093/acrefore/9780199381135.013.3907,https://doi.org/10.1093/acrefore/9780199381135.013.3907,crossref,2025-10-09T13:42:46+00:00
Written Documentation,2018,"Investigating Human Error: Incidents, Accidents, and Complex Systems",Barry Strauch,10.4324/9781315183053-10,https://doi.org/10.4324/9781315183053-10,crossref,2025-10-09T13:42:46+00:00
System Recorders,2018,"Investigating Human Error: Incidents, Accidents, and Complex Systems",Barry Strauch,10.4324/9781315183053-9,https://doi.org/10.4324/9781315183053-9,crossref,2025-10-09T13:42:46+00:00
Les « valises » encombrantes de la mémoire dans le théâtre de Ionesco,2006,"Le Temps de la mémoire : le flux, la rupture, l’empreinte",Viviane Barry,10.4000/books.pub.27981,https://doi.org/10.4000/books.pub.27981,crossref,2025-10-09T13:42:46+00:00
Bibliography of ball lightning reports,1974,Journal of Atmospheric and Terrestrial Physics,J.D. Barry,10.1016/0021-9169(74)90237-2,https://doi.org/10.1016/0021-9169(74)90237-2,crossref,2025-10-09T13:42:46+00:00
"Corn, Cash, Commerce: The Economic Policies of the Tory Governments, 1815–1830. By Boyd Hilton. Oxford University Press, 1977. Pp. 350. £8.50. - Political Economy in Parliament, 1819–1823 By Barry Gordon. London: Macmillan, 1976. Pp. 256. £10.00.",1979,The Historical Journal,Barry Supple,10.1017/s0018246x00017106,https://doi.org/10.1017/s0018246x00017106,crossref,2025-10-09T13:42:46+00:00
Meeting expectations,2001,Nursing Standard,Barry Hill,10.7748/ns2001.01.15.20.61.c2977,https://doi.org/10.7748/ns2001.01.15.20.61.c2977,crossref,2025-10-09T13:42:46+00:00
Current Inventory-Sales Relationships,1970,Brookings Papers on Economic Activity,Barry Bosworth,10.2307/2534172,https://doi.org/10.2307/2534172,crossref,2025-10-09T13:42:46+00:00
The Plant and the Coal,1986,Grand Street,Barry Spacks,10.2307/25006843,https://doi.org/10.2307/25006843,crossref,2025-10-09T13:42:46+00:00
Pulling together: Mitotic ring self‐assembly revealed,2007,Science News,Patrick Barry,10.1002/scin.2007.5591722405,https://doi.org/10.1002/scin.2007.5591722405,crossref,2025-10-09T13:42:46+00:00
"Brent Nelson: <i>Holy Ambition: Rhetoric, Courtship, and Devotion in the Sermons of John Donne</i>",2006,Journal of Religious History,Barry Spurr,10.1111/j.1467-9809.2006.00462.x,https://doi.org/10.1111/j.1467-9809.2006.00462.x,crossref,2025-10-09T13:42:46+00:00
A HISTORY WITHOUT THE HISTORY,2006,History and Theory,Barry Allen,10.1111/j.1468-2303.2006.00353.x,https://doi.org/10.1111/j.1468-2303.2006.00353.x,crossref,2025-10-09T13:42:46+00:00
Briefing: Civil engineering – identifying the profession's future direction,2009,Proceedings of the Institution of Civil Engineers - Civil Engineering,Barry Clarke,10.1680/cien.2009.162.2.51,https://doi.org/10.1680/cien.2009.162.2.51,crossref,2025-10-09T13:42:46+00:00
"Tio, Lorenzo, Jr.",2013,African American Studies Center,Barry Kernfeld,10.1093/acref/9780195301731.013.35403,https://doi.org/10.1093/acref/9780195301731.013.35403,crossref,2025-10-09T13:42:46+00:00
"Forrest, Jimmy",2013,African American Studies Center,Barry Kernfeld,10.1093/acref/9780195301731.013.35071,https://doi.org/10.1093/acref/9780195301731.013.35071,crossref,2025-10-09T13:42:46+00:00
"Ware, Wilbur",2013,African American Studies Center,Barry Kernfeld,10.1093/acref/9780195301731.013.35416,https://doi.org/10.1093/acref/9780195301731.013.35416,crossref,2025-10-09T13:42:46+00:00
"Bradford, Perry",2013,African American Studies Center,Barry Kernfeld,10.1093/acref/9780195301731.013.35202,https://doi.org/10.1093/acref/9780195301731.013.35202,crossref,2025-10-09T13:42:46+00:00
"Davis, Miles (Dewey, III)",2006,African American Studies Center,Barry Kernfeld,10.1093/acref/9780195301731.013.73126,https://doi.org/10.1093/acref/9780195301731.013.73126,crossref,2025-10-09T13:42:46+00:00
"Bostic, Earl",2013,African American Studies Center,Barry Kernfeld,10.1093/acref/9780195301731.013.35199,https://doi.org/10.1093/acref/9780195301731.013.35199,crossref,2025-10-09T13:42:46+00:00
75 Years Ago in JAF: Some Aspects of Folk-Song,1987,The Journal of American Folklore,Phillips Barry,10.2307/539992,https://doi.org/10.2307/539992,crossref,2025-10-09T13:42:46+00:00
Logiques terminologiques Taxinomic Logics : Terminologies of Kinship and the Relationship with Alliance Systems,2018,L'Homme,Laurent Barry,10.4000/lhomme.30722,https://doi.org/10.4000/lhomme.30722,crossref,2025-10-09T13:42:46+00:00
Titre I. Réparation en nature et exécution forcée,,La réparation en nature,Brunehilde Barry,10.4000/books.putc.2110,https://doi.org/10.4000/books.putc.2110,crossref,2025-10-09T13:42:46+00:00
Bidenomics,2023,Intereconomics,Barry Eichengreen,10.2478/ie-2023-0046,https://doi.org/10.2478/ie-2023-0046,crossref,2025-10-09T13:42:46+00:00
Testing for Sleep-Disordered Breathing in Psychiatric Practice,2024,The Journal of Clinical Psychiatry,Barry Krakow,10.4088/jcp.23lr15004,https://doi.org/10.4088/jcp.23lr15004,crossref,2025-10-09T13:42:46+00:00
Dynamic Capability Seen through a Duality–Paradox Lens: A Case of Radical Innovation at Microsoft,2014,Research in Organizational Change and Development,Barry Sugarman,10.1108/s0897-301620140000022003,https://doi.org/10.1108/s0897-301620140000022003,crossref,2025-10-09T13:42:46+00:00
The Elizabethan men of business and the implementation of domestic policy 1569-1584,,,Barry Shaw,10.14264/67f11c7,https://doi.org/10.14264/67f11c7,crossref,2025-10-09T13:42:46+00:00
Assessment centres,1995,Journal of European Industrial Training,Barry Winter,10.1108/03090599510079454,https://doi.org/10.1108/03090599510079454,crossref,2025-10-09T13:42:46+00:00
West African Economic and Monetary Union (UEMOA),2007,The Stateman’s Yearbook,Barry Turner,10.1007/978-1-349-74024-6_74,https://doi.org/10.1007/978-1-349-74024-6_74,crossref,2025-10-09T13:42:46+00:00
Policy for science — Australia,1992,Technology in Society,Barry Jones,10.1016/0160-791x(92)90025-6,https://doi.org/10.1016/0160-791x(92)90025-6,crossref,2025-10-09T13:42:46+00:00
El vino y los sueños,2012,Boletín de Antropología,Stéphane Barry,10.17533/udea.boan.11239,https://doi.org/10.17533/udea.boan.11239,crossref,2025-10-09T13:42:46+00:00
Pollution and poverty real threats to public,1999,British Journal of Healthcare Management,Barry Blatt,10.12968/bjhc.1999.5.9.19461,https://doi.org/10.12968/bjhc.1999.5.9.19461,crossref,2025-10-09T13:42:46+00:00
Supporting people with motor neurone disease,2009,British Journal of Neuroscience Nursing,Mel Barry,10.12968/bjnn.2009.5.1.37814,https://doi.org/10.12968/bjnn.2009.5.1.37814,crossref,2025-10-09T13:42:46+00:00
The Next Generation: Breaching the Final Frontiers of Practice,1997,Practice Nursing,Barry Blatt,10.12968/pnur.1997.8.5.14,https://doi.org/10.12968/pnur.1997.8.5.14,crossref,2025-10-09T13:42:46+00:00
With the Sails down,2001,The English Journal,Barry Ballard,10.2307/821919,https://doi.org/10.2307/821919,crossref,2025-10-09T13:42:46+00:00
Introduction,2008,Reconciling Our Aims,Barry Stroud,10.1093/acprof:oso/9780195370423.003.0001,https://doi.org/10.1093/acprof:oso/9780195370423.003.0001,crossref,2025-10-09T13:42:46+00:00
Green Political Economy I: Sufficiency and Security,2012,"The Politics of Actually Existing UnsustainabilityHuman Flourishing in a Climate-Changed, Carbon Constrained World",John Barry,10.1093/acprof:oso/9780199695393.003.0005,https://doi.org/10.1093/acprof:oso/9780199695393.003.0005,crossref,2025-10-09T13:42:46+00:00
"Greening Civic Republicanism II: A Green Republican Economy, Sustainability Service, and Agonistic Politics",2012,"The Politics of Actually Existing UnsustainabilityHuman Flourishing in a Climate-Changed, Carbon Constrained World",John Barry,10.1093/acprof:oso/9780199695393.003.0008,https://doi.org/10.1093/acprof:oso/9780199695393.003.0008,crossref,2025-10-09T13:42:46+00:00
8. Romanticism and the rise of nationalism,2010,Druids,Barry Cunliffe,10.1093/actrade/9780199539406.003.0008,https://doi.org/10.1093/actrade/9780199539406.003.0008,crossref,2025-10-09T13:42:46+00:00
"Exploring the Essence of Records Management, Engaging with Experts: Proceedings",2007,Records Management Journal,Rick Barry,10.1108/rmj.2007.28117bae.005,https://doi.org/10.1108/rmj.2007.28117bae.005,crossref,2025-10-09T13:42:46+00:00
Root rot diseases of sugar beet,2006,Zbornik Matice srpske za prirodne nauke,Barry Jacobsen,10.2298/zmspn0610009j,https://doi.org/10.2298/zmspn0610009j,crossref,2025-10-09T13:42:46+00:00
Dispute Resolution,2016,Law and Commerce in Pre-Industrial Societies,Barry Hawk,10.1163/9789004306226_005,https://doi.org/10.1163/9789004306226_005,crossref,2025-10-09T13:42:46+00:00
Bibliography,2016,Law and Commerce in Pre-Industrial Societies,Barry Hawk,10.1163/9789004306226_008,https://doi.org/10.1163/9789004306226_008,crossref,2025-10-09T13:42:46+00:00
Skepticism and Metaphysics,2022,Living Skepticism. Essays in Epistemology and Beyond,Barry Allen,10.1163/9789004525474_003,https://doi.org/10.1163/9789004525474_003,crossref,2025-10-09T13:42:46+00:00
Easy targets!,2015,Journal of Financial Crime,Barry Rider,10.1108/jfc-07-2015-075,https://doi.org/10.1108/jfc-07-2015-075,crossref,2025-10-09T13:42:46+00:00
‘I realised that I wasn't alone’: the views and experiences of young carers from a social capital perspective,2011,Journal of Youth Studies,Monica Barry,10.1080/13676261.2010.551112,https://doi.org/10.1080/13676261.2010.551112,crossref,2025-10-09T13:42:46+00:00
Biological features of genetic immunization,1997,Vaccine,M Barry,10.1016/s0264-410x(96)00265-4,https://doi.org/10.1016/s0264-410x(96)00265-4,crossref,2025-10-09T13:42:46+00:00
Testing for Additivity of a Regression Function,1993,The Annals of Statistics,Daniel Barry,10.1214/aos/1176349024,https://doi.org/10.1214/aos/1176349024,crossref,2025-10-09T13:42:46+00:00
Fear of failure: a place for the trial of instrumental delivery,1987,BJOG: An International Journal of Obstetrics &amp; Gynaecology,BARRY LOWE,10.1111/j.1471-0528.1987.tb02254.x,https://doi.org/10.1111/j.1471-0528.1987.tb02254.x,crossref,2025-10-09T13:42:46+00:00
The Date of A Circus Dialogue,1984,"Studies on Late Roman and Byzantine History, Literature and Languages",Barry Baldwin,10.1163/9789004673083_040,https://doi.org/10.1163/9789004673083_040,crossref,2025-10-09T13:42:46+00:00
Notes on The Greek-Coptic Glossary of Dioscorus of Aphrodito,1984,"Studies on Late Roman and Byzantine History, Literature and Languages",Barry Baldwin,10.1163/9789004673083_054,https://doi.org/10.1163/9789004673083_054,crossref,2025-10-09T13:42:46+00:00
The Defensive Expansion Approach to Multinational Banking: Evidence to Date,2002,"Financial Markets, Institutions &amp; Instruments",Barry Williams,10.1111/1468-0416.00008,https://doi.org/10.1111/1468-0416.00008,crossref,2025-10-09T13:42:46+00:00
Kicking the Habit: Moving from Pegged Rates to Greater Exchange Rate Flexibility,1999,The Economic Journal,Barry Eichengreen,10.1111/1468-0297.00413,https://doi.org/10.1111/1468-0297.00413,crossref,2025-10-09T13:42:46+00:00
Critical Pedagogy,1999,,Barry Kanpol,10.5040/9798400634093,https://doi.org/10.5040/9798400634093,crossref,2025-10-09T13:42:46+00:00
Non-steroidal anti-inflammatory drugs inhibit bone healing: A review,2010,Veterinary and Comparative Orthopaedics and Traumatology,S. Barry,10.3415/vcot-10-01-0017,https://doi.org/10.3415/vcot-10-01-0017,crossref,2025-10-09T13:42:46+00:00
Rank one perturbations and the zeros of paraorthogonal polynomials on the unit circle,2007,Journal of Mathematical Analysis and Applications,Barry Simon,10.1016/j.jmaa.2006.06.076,https://doi.org/10.1016/j.jmaa.2006.06.076,crossref,2025-10-09T13:42:46+00:00
Should your firm adopt a mass customization strategy?,2002,Business Horizons,Barry Berman,10.1016/s0007-6813(02)00227-6,https://doi.org/10.1016/s0007-6813(02)00227-6,crossref,2025-10-09T13:42:46+00:00
What Are We Really Looking at?,2006,Games and Culture,Barry Atkins,10.1177/1555412006286687,https://doi.org/10.1177/1555412006286687,crossref,2025-10-09T13:42:46+00:00
Protection against tissue damage in vivo by desferrioxamine: What is its mechanism of action?,1989,Free Radical Biology and Medicine,Barry Halliwell,10.1016/0891-5849(89)90145-7,https://doi.org/10.1016/0891-5849(89)90145-7,crossref,2025-10-09T13:42:46+00:00
Academic studing and the development of personal skill: A self-regulatory perspective,1998,Educational Psychologist,Barry Zimmerman,10.1207/s15326985ep3302&3_3,https://doi.org/10.1207/s15326985ep3302&3_3,crossref,2025-10-09T13:42:46+00:00
Anatomy and Physiology of Adipose Tissue,1989,Clinics in Plastic Surgery,Barry Markman,10.1016/s0094-1298(20)31337-7,https://doi.org/10.1016/s0094-1298(20)31337-7,crossref,2025-10-09T13:42:46+00:00
Oxygen radicals as key mediators in neurological disease: Fact or fiction?,1992,Annals of Neurology,Barry Halliwell,10.1002/ana.410320704,https://doi.org/10.1002/ana.410320704,crossref,2025-10-09T13:42:46+00:00
